task_id,keyword,location,job_id,company,title,created_on,description,url,summary,industries,soft_skills,hard_skills,tech_stack,programming_languages,education,salary,benefits
b186df715a3a4aa8b534d07ce3c293a1,Data Scientist,"Auburn Hills, MI",3962879302,Joyson Safety Systems,Application Engineer,1720579746.1668148,"Together We Saves Lives! The keys to success are yours at Joyson Safety Systems! We are a global leader in design, development and manufacturing of safety-critical systems and components for automotive and non-automotive markets. We are committed to bringing life-saving technology to customers worldwide. Joyson Safety Systems leverages the power of collaboration and innovation to provide quality and service excellence for our customers worldwide. Our company is headquartered in Auburn Hills, Michigan, USA, with a global network of more than 50,000 employees in 25 countries. Our team is passionate about the automotive industry, focused on delivering quality and innovation for the future. We encourage lifelong learning and provide the resources to help our team members build the foundation for a strong future with us. We strive to promote from within, offering excellent opportunities for career growth and advancement. Our talented team is hard working and dedicated to keeping people safe. We promote a collaborative, open culture; as a global business, we encourage our team members to communicate and work with colleagues around the world. As our operations continue to expand, we are always on the lookout for top talent to join our winning team. We are currently seeking a Integrated Safety Solutions Application Engineer-ISS for our Auburn Hills (Regional), Michigan facility. Summary: Application Engineer for new model and current production programs to ensure technical and project objectives are delivered on time, with quality, and ensuring Customer satisfaction. Duties/Responsibilities: • Occupant sensing components and full assembly integration • Manage preparation, audit evidence, and present Engineering deliverables throughout the Joyson Safety Design Review process • Prepare analytical reports relative to the status of design progress relative to project milestones • Act as the technical lead for specific Customer Occupant Classification System applications • Construct, maintain, coordinate, and communicate design related documents • Through mentoring, learn the Joyson Safety Systems engineering, procurement, production, and launch process in enough depth to ensure you can critically and effectively support the project team • Have the ability to learn assemblies, sequences, and associated constraints to accurately describe, manage, and resolve issues through tangible action plans • Work with suppliers, manufacturing, and quality to ensure robust designs are released • Develop and manage a clearly articulated Engineering Open Issues list, support project meetings, and drive issues to closure on time to a plan • Build customer relationships with active participation in Customer Open Issues meetings and meeting specification requirements • In addition to new model launches, manage production applications with change management tools and techniques • Manage preparation of prototype and pre-production build events with a cross functional support team Education • Bachelor’s degree in an Engineering discipline, Mechanical Engineering preferred • 2+ years of Automotive experience is preferred • Must be comfortable working with the Microsoft Office Suite (Excel, Word, Power Point, Outlook) • Must be familiar with CAD systems/concepts • Comfortable presenting and managing issues internally and externally Preferred Skills • Experience performing stackup analysis • Understanding of how to read and check Engineering prints and GD&T concepts • Fundamental understanding of the Engineering process – design, sourcing, tooling, quality qualification, validation, and launch • DFMEA development and coordination into the PFMEA • Design exposure will include plastics, harnesses, basic electrical schematics, and system level interaction • Change management skill set to ensure running production changes are coordinated with the project team with a result of limiting supply chain and customer risk • Strong organizational, analytical, verbal and written communication skills • Able to work and communicate well with others in a team environment including customers and supplier partners • Must be diplomatically persuasive and professionally assertive when required to make sound Engineering decisions • Desire to grow through mentorship and develop skillsets to eventually take lead Engineering responsibility for a project • Highly skilled at taking large quantities of information and presenting it in a clear and concise manner • Must be willing to travel 5%-10% domestically and internationally for internal, customer, and project related visits The Company is an Equal Employment Opportunity (EEO) employer and does not discriminate in any employer/employee relations based on race, color, religion, sex, sexual orientation, national origin, age, marital status, disability, veteran’s status, or any other basis protected by applicable discrimination laws.",https://www.linkedin.com/jobs/view/3962879302,"Application Engineer for new model and current production programs to ensure technical and project objectives are delivered on time, with quality, and ensuring Customer satisfaction.  Responsible for occupant sensing components and full assembly integration.  Must be comfortable working with the Microsoft Office Suite, familiar with CAD systems/concepts, and comfortable presenting and managing issues internally and externally. ","Automotive,Manufacturing,Engineering,Technology","Communication,Presentation,Teamwork,Leadership,Problem Solving,Organization,Analysis,Mentorship,Decision Making,Customer Service,Interpersonal,Persuasion,Assertiveness","Microsoft Office Suite,CAD,Stackup Analysis,GD&T,DFMEA,PFMEA,Plastics,Harnesses,Electrical Schematics,Change Management","CAD,DFMEA,PFMEA",,"{""min_degree"": ""Bachelor\u2019s degree"", ""fields"": [""Engineering"", ""Mechanical Engineering""]}","{""max"": 0, ""min"": 0}",
b186df715a3a4aa8b534d07ce3c293a1,Data Scientist,"Warren, MI",3887698381,CIeNET Technologies,Software Engineer,1720579747.3995166,"CIeNET is a leading global technical consulting, software engineering, and technical solutions provider. Our team is working on design, development and maintenance of best-in-class platforms in automotive, enterprise, mobility industries for leading OEMs and looking for experienced software engineers. Candidate will play a key role in our software and test automation development, diagnostics and troubleshooting, and bug fixing that will improve product performance and stability. Day to day responsibilities include: Develop test cases and enhance test automation Triage, troubleshoot, and develop software fixes to reach the required performance targets Be responsible for the complete SDLC, including requirements analysis, design, development, code review, integration, and maintenance Collaborate with team members for software development activities using the Scrum/Agile development process Requirements Bachelor's degree or above in Computer Science, Computer/Electrical Engineering or equivalent 5+ years of software engineering experience Expert knowledge of computer science, with strong competencies in data structures, algorithms, and software design Ability to write clean, maintainable and testable code Passionate about automation and instrumentation Good knowledge on system stress, load, reliability, and endurance testing. Experience with system KPI analysis Strong problem solving and debugging skills on Linux systems Excellent technical communication, and interpersonal and teamwork skills Domain knowledge on networking, BT, audio, video, video conferencing, camera, or browsers will be a plus Experience programing with GoLang will be a plus Familiarity with web or Android automation framework will be a plus Benefits Full-time salaried position Excellent Health Benefits PTO and Sick Leave 401K Matching This is NOT a remote position",https://www.linkedin.com/jobs/view/3887698381,"CIeNET seeks experienced Software Engineers for design, development, and maintenance of platforms for the automotive, enterprise, and mobility industries. Responsibilities include test automation development, diagnostics, troubleshooting, and bug fixing to enhance product performance and stability. The role involves the entire SDLC, Agile collaboration, and strong technical, problem-solving, and communication skills.","Automotive,Enterprise Software,Mobility,Technology Consulting,Software Engineering","Problem Solving,Debugging,Communication,Teamwork,Collaboration,Passion for Automation,Analytical Thinking","Software Engineering,Data Structures,Algorithms,Software Design,Test Automation,System Stress Testing,Load Testing,Reliability Testing,Endurance Testing,KPI Analysis,Linux Systems,GoLang,Web Automation,Android Automation,SDLC,Agile,Scrum","GoLang,Linux",GoLang,"{""min_degree"": ""Bachelor's Degree"", ""fields"": [""Computer Science"", ""Computer/Electrical Engineering""]}","{""max"": 0, ""min"": 0}","Full-time Salaried Position,Health Benefits,PTO,Sick Leave,401K Matching"
b186df715a3a4aa8b534d07ce3c293a1,Data Scientist,"Ann Arbor, MI",3679535334,KLA,Algorithm Engineer (Deep Learning/C++)(E),1720579748.6430113,"Base Pay Range: $77,800.00 - $132,300.00 Primary Location: USA-MI-Ann Arbor-KLA KLA’s total rewards package for employees may also include participation in performance incentive programs and eligibility for additional benefits identified below. Interns are eligible for some of the benefits identified below. Our pay ranges are determined by role, level, and location. The range displayed above reflects the minimum and maximum pay for this position in the primary location identified in this posting. Actual pay depends on several factors, including location, job-related skills, experience, and relevant education level or training. If applicable, your recruiter can share more about the specific pay range for your preferred location during the hiring process. Company Overview KLA is a global leader in diversified electronics for the semiconductor manufacturing ecosystem. Virtually every electronic device in the world is produced using our technologies. No laptop, smartphone, wearable device, voice-controlled gadget, flexible screen, VR device or smart car would have made it into your hands without us. KLA invents systems and solutions for the manufacturing of wafers and reticles, integrated circuits, packaging, printed circuit boards and flat panel displays. The innovative ideas and devices that are advancing humanity all begin with inspiration, research and development. KLA focuses more than average on innovation and we invest 15% of sales back into R&D. Our expert teams of physicists, engineers, data scientists and problem-solvers work together with the world’s leading technology providers to accelerate the delivery of tomorrow’s electronic devices. Life here is exciting and our teams thrive on tackling really hard problems. There is never a dull moment with us. Job Description/Preferred Qualifications Algorithm Engineers are core to KLA’s technology, while we do not currently have an opening, we are always building our Algorithm Engineering talent community, we are interested in learning about your background. Apply to this posting for Future Opportunities with KLA. Responsibilities In this role, you will: Contribute to novel image processing, defect detection and analysis, and optimization algorithms balancing sophistication and computational complexity through comprehensive data analysis. Evaluate and productize deep learning and other novel approaches that complement and improve the performance of existing algorithms in the inspection space. Collaborate with software and computer groups to design and implement data management, model training and inference flows. Bring forward creative ideas, develop proof-of-concepts, integrate algorithms into production code, and work with other team members in global project teams. Qualifications: Academic background required in any of the following areas: Image Processing, Computational Imaging, Computer Vision; Practical experience with Deep Learning, Machine Learning, or Artificial Intelligence, for images, is preferred; Capable of prototyping Algorithms using MATLAB or Python, and implementing algorithms in C++ software under Linux is preferred; Familiarity with any of the following is a plus: Linear and Nonlinear Optimization techniques, CUDA/GPU Programming frameworks (e.g., TensorFlow), and Data Analysis and Visualization tools. Minimum Qualifications Master's Level Degree and 0 years related work experience; Bachelor's Level Degree and related work experience of 2 years The company offers a total rewards package that is competitive and comprehensive including but not limited to the following: medical, dental, vision, life, and other voluntary benefits, 401(K) including company matching, employee stock purchase program (ESPP), student debt assistance, tuition reimbursement program, development and career growth opportunities and programs, financial planning benefits, wellness benefits including an employee assistance program (EAP), paid time off and paid company holidays, and family care and bonding leave. KLA is proud to be an Equal Opportunity Employer. We do not discriminate on the basis of race, religion, color, national origin, sex, gender identity, gender expression, sexual orientation, age, marital status, veteran status, disability status or any other status protected by applicable law. We will ensure that qualified individuals with disabilities are provided reasonable accommodation to participate in the job application or interview process, to perform essential job functions, and to receive other benefits and privileges of employment. Please contact us at talent.acquisition@kla.com to request accommodation.",https://www.linkedin.com/jobs/view/3679535334,"KLA, a global leader in semiconductor manufacturing technology, is seeking Algorithm Engineers to join their talent community. This role involves developing image processing, defect detection, and optimization algorithms. Experience with deep learning, machine learning, and artificial intelligence for image processing is preferred. Candidates should have strong programming skills in MATLAB, Python, and C++ under Linux. Familiarity with optimization techniques, CUDA/GPU programming frameworks, and data analysis tools is a plus.","Semiconductors,Electronics,Manufacturing,Technology,Research and Development","Communication,Collaboration,Problem Solving,Creativity,Analytical Skills,Teamwork,Data Analysis","Image Processing,Defect Detection,Optimization Algorithms,Deep Learning,Machine Learning,Artificial Intelligence,MATLAB,Python,C++,Linux,Linear and Nonlinear Optimization,CUDA/GPU Programming,TensorFlow,Data Analysis,Visualization","MATLAB,Python,C++,Linux,CUDA/GPU,TensorFlow","MATLAB,Python,C++","{""min_degree"": ""Bachelor's Level Degree"", ""fields"": [""Image Processing"", ""Computational Imaging"", ""Computer Vision"", ""Deep Learning"", ""Machine Learning"", ""Artificial Intelligence""]}","{""max"": 132300, ""min"": 77800}","Medical,Dental,Vision,Life Insurance,401(K) with company matching,Employee Stock Purchase Program,Student Debt Assistance,Tuition Reimbursement,Development and Career Growth Opportunities,Financial Planning Benefits,Wellness Benefits including EAP,Paid Time Off,Paid Holidays,Family Care and Bonding Leave"
b186df715a3a4aa8b534d07ce3c293a1,Data Scientist,"Wyandotte, MI",3970286127,BASF,"Senior Scientist I, Application Testing and Technical Services, Home Care I&I, Wyandotte, MI",1720579749.7924278,"Now hiring! Senior Scientist , Application Testing & Technical Services, Care Chemicals Where the chemistry happens... As the leading global chemical supplier for the personal care, home care, industrial and institutional cleaning industries, and technical applications in the agrochemical industry, BASF Care Chemicals is focused on partnering with customers to create innovative solutions with great speed and agility to meet the current and future needs of society in a more sustainable way. We are proud to contribute to the long-term success of our customers’ brands by offering a broad range of products and concepts such as common household items, like cosmetics, detergents and cleaners, as well as industrial products and processes like crop protection, rubber belts, hoses, concrete, and metal plating. At Care Chemicals, we not only care about supporting our customers and achieving strong business results; we care about our team members. We aim to create a motivating, inspiring and inclusive work environment where all team members feel supported, heard and developed. Being part of our team means showing up every day to work collaboratively across functions to win for the overall success of the team. We value bringing diverse perspectives and backgrounds together to stretch our teams to think differently, have the courage to speak up and challenge the status quo, and problem solve for the greater good of our customers and society. We as the Care Chemicals division of BASF carry the passion to care in our DNA: we care for our customers, consumers, employees, society and our planet. Come, be a part of our team and create Care Chemicals with us. As a Sr. Scientist I, you will work with BASF's comprehensive Care Chemicals portfolio to develop a variety of cleaning product formulations for home care, industrial & institutional applications, using standardized and internal test methods, as well as collect essential application data that is used by our commercial and technical service colleagues to promote BASF products and expertise to customers. Alongside a team of Chemists and Scientists, you will also use statistical tools such as JMP® and Excel® as well as design of experiments (DOE) techniques to plan, execute, and analyze test results. As a Senior Scientist I, you create chemistry by... Utilizing your strong scientific aptitude to independently execute projects and address in-depth technical challenges for industry and customer needs (e.g. cold water cleaning, concentrated formulations, bio-based formulas, etc.). Utilizing your creative thinking to collaborate closely with commercial members of our team to develop new selling stories for our products. Sharing your expertise in surfactants, colloids or interfacial science with other technical members of the team to aid in knowledge creation for the business, including drawing inspiration from patent and scientific literature. Applying statistical tools and efficient test methods such as JMP® and design-of-experiments (DOE) to create predictive modeling and identify complex interactions between formulation ingredients. Presenting your work to internal partners and external customers. If you... Have a doctoral or Masters degree in Chemistry, Chemical Engineering, or related fields. Have preferably 3+ years of relevant work experience (i.e. surfactant science, colloidal systems, formulation, etc.), or at least 5 years’ experience in colloid and surfactant technical areas. Create your own chemistry with you@BASF At BASF, you will have the chance to do meaningful work towards building a more sustainable future. In addition to competitive compensation and benefits, BASF provides you with access to a wide range of elements to help you be your best. It’s what we call you@BASF . We are committed to providing benefits, programs, and opportunities that support our employees’ overall well-being, personal growth, and a safe, collaborative, and inclusive work environment. Just some of the many benefits we offer include: Flexible work arrangements whenever possible Highly competitive retirement savings plan with company match and investment options Well-being programs that include comprehensive mental health support for you and your household family members Family forming benefits (fertility, adoption and surrogacy reimbursement, maternity/parental leave, and more) Back-up child and elder care with discount programs for families of all ages and stages Mentoring and career development opportunities that allow you to share, learn, and thrive Matching gifts program that allows you to deepen the impact of your contributions to qualified charities. Employee crisis support for when the unexpected happens Access to our BASF wine cellar, employee discounts, and much more! About Us As one of the largest chemical companies in North America we have been finding solutions for your everyday needs and addressing the most complex economic, environmental, and sustainability challenges for more than 150 years! At BASF we empower our employees with the tools, guidance and opportunities they need to advance and succeed in work and life. Giving you the support you need to be your best and fulfill your personal ambitions is what helps us create chemistry. After all, our success is linked to yours. Whatever path you envision, BASF is a great place to build a rewarding, successful career. Belong to Something Bigger #belongatBASF Privacy statement BASF takes security & data privacy very seriously. We will never request financial information of any kind via email, private text message or direct message on any social medial platform or job board. Furthermore, we will never send a candidate a check for equipment or request any type of payment during the job application process. If you have experienced any of the above, please contact myhr@basf.com to report fraud. Equal employment opportunities We are an equal opportunity employer, and all qualified applicants will receive consideration for employment without regard to race, age, citizenship, color, religion, sex, marital status, national origin, disability status, gender identity or expression, protected veteran status, or any other characteristic protected by law. Applicants must be currently authorized to work in the United States on a full-time basis.",https://www.linkedin.com/jobs/view/3970286127,"BASF Care Chemicals is seeking a Senior Scientist to develop cleaning product formulations for home care and industrial & institutional applications. The ideal candidate will have a PhD or Master's degree in Chemistry, Chemical Engineering, or a related field, 3+ years of relevant work experience, and experience with surfactants, colloids, and interfacial science. This role involves executing projects, addressing technical challenges, collaborating with commercial teams, presenting work to internal and external stakeholders, and applying statistical tools such as JMP® and design-of-experiments (DOE).","Chemicals,Personal Care,Home Care,Industrial Cleaning,Institutional Cleaning,Agrochemical","Communication,Collaboration,Problem Solving,Creativity,Presentation Skills,Statistical Analysis,Scientific Aptitude,Project Management,Technical Expertise","Surfactants,Colloids,Interfacial Science,Formulation Development,JMP®,Design of Experiments (DOE),Statistical Analysis,Excel®,Patent and Scientific Literature Review","JMP®,Excel®",JMP®,"{""min_degree"": ""Master's"", ""fields"": [""Chemistry"", ""Chemical Engineering""]}","{""max"": 0, ""min"": 0}","Flexible Work Arrangements,Retirement Savings Plan with Company Match,Well-being Programs,Family Forming Benefits,Back-up Child and Elder Care,Mentoring and Career Development Opportunities,Matching Gifts Program,Employee Crisis Support,BASF Wine Cellar,Employee Discounts"
