task_id,keyword,location,job_id,company,title,created_on,description,url,summary,industries,soft_skills,hard_skills,tech_stack,programming_languages,education,salary,benefits
b186df715a3a4aa8b534d07ce3c293a1,Data Scientist,"Michigan, United States",3842171604,Dematic,Sr. AI Scientist,1720579687.5358725,"Our Warehouse Execution Software leverages advances in classical and modern optimization techniques to bring intelligent execution to the world of intralogistics and warehouse automation. We synchronize discrete and low-level logistics related processes to create a real-time decision engine that drives labor and equipment at the highest efficiency. Our software provides customers the operational agility they need to efficiently handle the demands of an Omni-channel environment. We are looking for a highly motivated individual who can develop cutting edge algorithms using domain knowledge from Machine Learning, Computer Vision, and Operations Research. The candidate should not only have a solid grasp of theoretical approaches but also a practical mindset regarding the tradeoffs between solution complexity versus optimality, emerging versus proven techniques, and coding from scratch versus utilizing existing frameworks. Many of the problems we encounter are novel and have never been solved before, so creative, out-of-the-box thinking and a fondness for experimentation are a must. We also want someone who stays current with recent trends in AI/ML so our approaches remain the most robust and competitive in the industry. Finally, the role requires strong team and interdisciplinary collaboration to see products through the development cycle from beginning to end. What we offer: What We Offer: Career Development Competitive Compensation and Benefits Pay Transparency Global Opportunities Learn More Here: https://www.dematic.com/en-us/about/careers/what-we-offer Dematic provides equal employment opportunities to all employees and applicants for employment and prohibits discrimination and harassment of any type without regard to race, color, religion, age, sex, national origin, disability status, genetics, protected veteran status, sexual orientation, gender identity or expression, or any other characteristic protected by federal, state, or local laws. This policy applies to all terms and conditions of employment, including recruiting, hiring, placement, promotion, termination, layoff, recall, transfer, leaves of absence, compensation, and training. The base pay range for this role is estimated to be $ 82,000-166,000 at the time of posting. Final compensation will be determined by various factors such as work location, education, experience, knowledge, and skills. Tasks and Qualifications: This is What You Will do in This Role: Apply AI principles and technologies to solve and/or improve planning, automation, search, classification, recommendation, prediction, and optimization problems arising from the need to streamline supply chain operations, sometimes involving synthesis of components in production. See solution through full development cycle from inception to proof of concept, to MVP, to final product deployment. Ensure what is delivered meets business requirements. Work directly with real and synthetic data from building pipelines for on-site acquisition, experimenting with datasets that are used to train models powering data-driven solutions. Identify and develop model-centric solutions architecture. Develop model-based POCs leveraging advances in GPU, Sensor Fusion, Edge and Cloud Computing technologies for performance increase of high-automation intralogistics systems. Design and build statistical forecasting and machine learning models. Support the matter experts in commercial AI and autonomy solutions delivery. Learn and apply new tools, technologies, and industry best practices. What We are Looking For: Master’s or PhD in Computer Science, Artificial Intelligence, Electrical Engineering, Operations Research, Machine Learning, Control Engineering, Industrial Engineering, or related field. Knowledge of standard Machine Learning models and techniques: Linear regression, logistic regression, decision trees, SVM, kNN, ensemble learning, XGBoost. Knowledge of Deep Learning architectures and use cases: ANN, CNN, RNN, VAE. Background in Perception, Machine Vision, Robotics, or related fields. Experience with Python/C++, ROS, and widely used AI/ML SDKs on edge devices. 5+ yrs developing AI/ML solutions under Agile methodologies and CI/CD. 5+ yrs practicing asset control and documentation—Git, Confluence. Familiarity with some of the following AI and Data Science frameworks: Pandas, PyTorch, Tensorflow/Keras, MXNET, Scikit-learn, Matplotlib, Numpy, fast.ai, Tensorboard, Ignite, Neptune, etc. 5+ years of experience, including academic experience, in any of the above. 5+ yrs delivering models into production – CNNs, LSTMs, Transformers, Ensemble Classifiers, etc. 5 yrs usage of CUDA, PyTorch, TensorFlow—or similar. Experience identifying and working with applicable key open-source SDKs, frameworks, and tools. Ability to accommodate some domestic and international travel. Ways to Stand Out PhD in Machine Learning, Mathematics, Statistics, Physics, Engineering, or equivalent experience. Ability to communicate with stakeholder audiences of various seniority levels and backgrounds. Experience with deploying ML models on the edge for real time applications, and edge lifecycle management Proficiency with NVIDIA’s edge technologies (CUDA, Deepstream, & TensorRT SDKs.) Proficiency with containerization & orchestration tools like Docker, Kubernetes, Helm, Terraform Proficiency in Unity, Nvidia Omniverse or similar simulation engines. Natural inclination for and/or record of leadership and engineering best-practices— test-driven development, patterns, conventions, and delivery standards. Familiarity with Robotics, PLC programming, Predictive Maintenance, or Reinforcement Learning is a plus.",https://www.linkedin.com/jobs/view/3842171604,"Dematic is seeking a highly motivated AI/ML engineer to develop cutting-edge algorithms for their Warehouse Execution Software. The ideal candidate will have a strong theoretical understanding of machine learning and computer vision, as well as practical experience with optimization techniques. The role involves developing AI-powered solutions for supply chain operations, working with real and synthetic data, building pipelines, training models, and deploying solutions. The candidate will also be involved in identifying and developing model-centric solutions architecture and supporting the delivery of commercial AI and autonomy solutions.","Software Development,Logistics,Supply Chain Management,Warehouse Automation,Intralogistics,Artificial Intelligence,Machine Learning,Computer Vision,Operations Research","Highly motivated,Creative,Out-of-the-box thinking,Fondness for experimentation,Strong team player,Interdisciplinary collaboration,Communication skills,Leadership,Problem solving","Python,C++,ROS,Machine Learning,Deep Learning,Linear Regression,Logistic Regression,Decision Trees,SVM,kNN,Ensemble Learning,XGBoost,ANN,CNN,RNN,VAE,Perception,Machine Vision,Robotics,GPU,Sensor Fusion,Edge Computing,Cloud Computing,Statistical Forecasting,Agile Methodologies,CI/CD,Git,Confluence,Pandas,PyTorch,Tensorflow,Keras,MXNET,Scikit-learn,Matplotlib,Numpy,fast.ai,Tensorboard,Ignite,Neptune,CUDA,Docker,Kubernetes,Helm,Terraform,Unity,Nvidia Omniverse,PLC programming,Predictive Maintenance,Reinforcement Learning","Python,C++,ROS,PyTorch,Tensorflow,Keras,MXNET,Scikit-learn,CUDA,Docker,Kubernetes,Helm,Terraform,Unity,Nvidia Omniverse","Python,C++","{""min_degree"": ""Master\u2019s"", ""fields"": [""Computer Science"", ""Artificial Intelligence"", ""Electrical Engineering"", ""Operations Research"", ""Machine Learning"", ""Control Engineering"", ""Industrial Engineering""]}","{""max"": 166000, ""min"": 82000}","Competitive Compensation,Benefits,Career Development,Global Opportunities"
b186df715a3a4aa8b534d07ce3c293a1,Data Scientist,"Grand Rapids, MI",3969200559,Meijer,Principal Data Scientist - RMN,1720579688.7731237,"As a family company, we serve people and communities. When you work at Meijer, you’re provided with career and community opportunities centered around leadership, personal growth and development. Consider joining our family – take care of your career and your community! Meijer Rewards Weekly pay Scheduling flexibility Paid parental leave Paid education assistance Team member discount Development programs for advancement and career growth Please review the job profile below and apply today! The Data Science team at Meijer leads the strategy, development and integration of Machine Learning and Artificial Intelligence at Meijer. As a Principal Data Scientist for the Retail Media Network, your crucial contributions will amplify customer engagement and satisfaction, boost digital conversion rates, and enhance operational efficiency through innovative, data-focused strategies for tailoring and assessing campaign performance. This encompasses the implementation of closed-loop measurement, last-touch and multi-touch attribution, as well as incremental measurement and personalization techniques. By deploying these methodologies, data scientists at Meijer deliver substantial business value, reduce risks associated with business operations, and make a marked difference in the customer experience. In this capacity, you will engage directly with teams across product development, merchandising, marketing, operations, ITS, e-commerce, and external vendor partners. Your responsibilities will include leading, advising, or managing a portfolio of highly complex data science projects, programs, or domains that significantly influence the company and necessitate a deep understanding of various architectural disciplines, including technological, solution-oriented, business, and informational/data aspects. What You'll Be Doing Execute the overarching RMN data science strategy to drive in-store and digital merchandising, marketing, customer loyalty, and operational performance Collaborate with product development to establish requirements that align with both system capabilities and customer experience objectives for data science initiatives. Develop, deploy, and perfect a last-touch and multi-touch attribution framework for the retail media network through teamwork with marketing, operations, data engineering, product management, & other key players, leveraging diverse data sources including digital and in-store. Spearhead the design and execution of advanced statistical modeling techniques and machine learning algorithms to analyze complex data sets, uncover key drivers of consumer behavior, and attribute marketing touchpoints accurately. Plan and manage A/B testing to confirm and enhance the attribution model’s efficacy, ensuring its reliability and statistical validity. Keep up-to-date with the latest developments in incrementality, last-touch and multi-touch attribution techniques, industry movements, and new technologies, incorporating them to improve the model’s accuracy. Promote ongoing refinement and enhancement of the attribution & incrementality model by monitoring its effectiveness, analyzing performance indicators, and making informed adjustments. Build production ready prototypes for, and iteratively develop, end-to-end data science pipelines including custom algorithms, statistical models, machine learning and artificial intelligence functions supporting RMN team initiatives Partner with product development and technology teams to deploy pipelines into production MLOps environment following Safe Agile methodology You will architect, design, and lead the development and implementation of machine learning algorithms and models for a data science capability within Digital Services, Merchandising, Marketing, Supply Chain and Operations. Designs, codes, and implements new industry leading design patterns in data science, to create the convention/technique/practice that teams are accountable to follow. Foster a culture of innovation by keeping up-to-date with the latest industry trends and research across RMN, IAB/MRC retail media measurement standards, data science, AI and retail. Mentors and provides technical leadership to a team of data scientists, promoting a culture of collaboration, innovation, curiosity, accountability, & enthusiasm. Provides data science strategy to ensure code modernization and industry standard patterns for data science. Provides guidance to development teams within domain (Commerce, Services or Mobile). Leads non-functional requirements (NFRs) such as security, reliability, performance, maintainability, scalability, and usability related to data science. Promotes the implementation of new technology, solutions, and methods to improve business processes, efficiency, effectiveness, and value delivered to customers. Proactively identify data driven solutions for strategic cross-functional initiatives, develop and present business cases, and gain stakeholder alignment of solution Responsible to define, document & follow best practices & approve for ML/AI development at Meijer Own communication with data consumers (internal and external) to ensure they understand the data science products, have the proper training, and are following the best practices in application of data science products Define and analyze Key Performance Indicators to monitor the usage, adoption, health and value of the data products Identify and scope, in conjunction with IT, the architecture of systems and environment needs to ensure that data science systems can deliver against strategy Build and maintain relationships with key partners, suppliers and industry associations and continue to advance data science capabilities, knowledge and impact This job profile is not meant to be all inclusive of the responsibilities of this position; may perform other duties as assigned or required What You Bring With You (Qualifications) Advanced Degree (MA/MS, PhD) in Data Science, Computer Science, Mathematics, Statistics, Economics, or related quantitative field Certifications: Azure Data Science Associate, Azure AI, Safe Agile 8+ years of relevant data science experience in an applied role – preferable w/in retail, logistics, supply chain or CPG with a focus on NLP and AI",https://www.linkedin.com/jobs/view/3969200559,"Meijer, a family company, seeks a Principal Data Scientist to lead the strategy, development, and integration of Machine Learning and Artificial Intelligence within their Retail Media Network (RMN). This role involves driving customer engagement, boosting digital conversion rates, enhancing operational efficiency, and contributing to the company's overall data science strategy.","Retail,E-commerce,Marketing,Supply Chain,Logistics,Consumer Packaged Goods (CPG)","Leadership,Communication,Collaboration,Innovation,Problem Solving,Presentation,Mentorship,Strategic Thinking,Analytical Skills,Relationship Building,Proactive,Teamwork,Curiosity,Accountability,Enthusiasm,Adaptability","Machine Learning,Artificial Intelligence,Data Science,Statistical Modeling,NLP (Natural Language Processing),AI,A/B Testing,Data Analysis,Data Engineering,Data Visualization,Python,R,SQL,Azure Data Science Associate,Azure AI,Safe Agile","Azure Data Science,Azure AI,Safe Agile,Machine Learning,Artificial Intelligence,NLP","Python,R,SQL","{""min_degree"": ""Master's Degree"", ""fields"": [""Data Science"", ""Computer Science"", ""Mathematics"", ""Statistics"", ""Economics""]}","{""max"": 0, ""min"": 0}","Weekly pay,Scheduling flexibility,Paid parental leave,Paid education assistance,Team member discount,Development programs for advancement and career growth"
b186df715a3a4aa8b534d07ce3c293a1,Data Scientist,"Brighton, MI",3835771283,blueflite,Full-stack Software Engineer (React/NextJS/Python),1720579690.0522017,"Location Detroit/Ann Arbor/Brighton, MI - United States of America (USA) or Syracuse, NY (United States of America (USA) About Us blueflite designs and manufactures high performance, electric, unmanned, aerial tilt-rotor vehicles for the delivery of light cargo. Our UAV platform is scalable and has unique and patented design characteristics resulting in advanced capability regarding maneuverability and vehicle control. blueflite has extensive experience in carbon fiber structure design and manufacturing, design of propulsion systems, developing advanced flight control algorithms, implementation of code in on-board computer systems, and developing a digital ground infrastructure. We are looking for innovative and solutions-oriented engineers and entrepreneurs to be part of our amazing technology development journey creating the next generation of logistic technology platform centered around our unique, agile, and robust UAV design. If the idea of working with ground-breaking technologies to develop the next generation of cargo UAV and logistic technology platforms has your attention, then keep reading. About The Role The blueflite team is developing an entire ecosystem and integrated platform to support autonomous operations of vertical lift systems. Among the platform's components are a variety of web application frontends, backend APIs, and services, both client-facing and internal. Your role will be to lead in the continued development and improvement of these components and the development of additional applications and utilities. Day to day work at blueflite centers around an agile-based approach in small teams of brilliant scientists, engineers, software developers, technicians, pilots, and experts all working towards a world class UAV technology platform. Primary areas of responsibility: Develop and enhance multiple web application frontends/backends and services, from UI/UX mockup to implementation, QA, and versioning Manage deployments/release management across multiple environments and systems Provide guidance on the choices of frameworks and architecture for future projects Build and lead the software team as we grow Collaboration with a multidisciplinary team of other engineers and product owners to develop attractive and intuitive interfaces, and robust and secure backends About You Can work in small agile teams with a great attitude and excellent communication skills 3+ years of real-world experience developing full-stack web applications using React/NextJS Experience with Python for API and service/utility development Experience developing in macOS or Linux/VSCode/Git environments B.S. in Computer Science (or equivalent) Bonus: Cloud DevOps experience Bonus: Machine learning development and deployment experience Bonus: Embedded systems development and/or experience with Nvidia Jetson products Benefits Paid Time Off | Health Insurance | Dental | Vision | Equity Powered by JazzHR RWRSrBQZbZ",https://www.linkedin.com/jobs/view/3835771283,"blueflite is seeking a full-stack web developer to lead the development and improvement of web applications, APIs, and services for their autonomous vertical lift systems. The role involves building, managing, and deploying web applications, guiding framework and architecture choices, and leading the software team. The ideal candidate has 3+ years of experience with React/NextJS, Python, macOS/Linux development, and a BS in Computer Science. Bonus points for Cloud DevOps, machine learning, and embedded systems experience.","Aerospace,Technology,Software Development,Logistics,Unmanned Aerial Vehicles (UAV)","Communication,Collaboration,Problem Solving,Leadership,Agile","React,NextJS,Python,API Development,Web Services,UI/UX,Deployment,Release Management,Cloud DevOps,Machine Learning,Embedded Systems,Nvidia Jetson,Git,VSCode,macOS,Linux","React,NextJS,Python,API Development,Web Services,Cloud DevOps,Machine Learning,Nvidia Jetson","React,NextJS,Python","{""min_degree"": ""B.S."", ""fields"": [""Computer Science""]}","{""max"": 0, ""min"": 0}","Paid Time Off,Health Insurance,Dental,Vision,Equity"
b186df715a3a4aa8b534d07ce3c293a1,Data Scientist,"Auburn Hills, MI",3968616549,Joyson Safety Systems,Application Engineer,1720579691.3543818,"Together we save lives! The keys to success are yours at Joyson Safety Systems! We are a global leader in the design, development and manufacturing of safety-critical systems and components for automotive and non-automotive markets. We are committed to bringing life-saving technology to customers worldwide. Joyson Safety Systems leverages the power of collaboration and innovation to provide quality and service excellence for our customers worldwide. Our company is headquartered in Auburn Hills, Michigan, USA, with a global network of more than 50,000 employees in 25 countries. Our team is passionate about the automotive industry and is focused on delivering quality and innovation for the future. As our operations continue to expand, we are always on the lookout for top talent to join our winning team. We are currently seeking for an Application Engineer in our Application Engineering department, if you are looking to enhance your career with a dynamic, growing company, then we encourage you to apply and join the JSS team. Responsibilities and duties: Design the product shape and structure, and use tools FMEA and DRBFM to analyse the potential failure of the design, and take preventive measures to avoid the failure; Attend the design review, to ensure the product meets the target of performance, project schedule, cost and other objectives. Summarize L&L, patent, competitive analysis, combined with theoretical knowledge, and optimize the products design. According to the customer orders, release the sample trial order, support the sample inspection, sample warehousing, etc., and support the completion of the sample preparation in the development stage. Responsible for the analysis and solution of quality issues in DV stage, including supplier quality, product design problems, etc. Support to complete the testing of DV phase, and participate in the issue analysis and solving, to ensure the customer's schedule. Support the core engineering to research and develop scientific and effective product development verification methods, to improve the efficiency and quality of product development. According to the customers needs and VAVE projects, complete the related VAVE engineering development work. Support the process planning of production line; Participate in quality analysis to solve quality issues. Project documentation and communication. Create the QTP (Qualification Test Plan) according to legal and customer specifications. Planning / tracking of the testing program Analysis of test reports Communication with the customer about test requirements and test results. Education and Experience: Technician or Bachelor degree in Engineering or related major. 1+ years experience in application engineering in automobile industry. We are an Affirmative Action/EEO employer. All qualified applicants will receive consideration for employment without regard to race, color, sex, sexual orientation, gender identity or expression, religion, national origin, age, disability, genetics, protected veteran status or any other characteristic protected by federal, state, or local laws.",https://www.linkedin.com/jobs/view/3968616549,"Joyson Safety Systems is seeking an Application Engineer to design safety-critical automotive components. Responsibilities include product design, failure analysis, sample order management, quality issue resolution, testing support, VAVE development, process planning, and communication with customers. Requires a minimum of 1 year of experience in application engineering within the automotive industry.","Automotive,Manufacturing,Engineering","Communication,Problem Solving,Teamwork,Analytical Skills,Project Management","FMEA,DRBFM,Design Review,L&L Analysis,Patent Analysis,Competitive Analysis,Quality Issue Resolution,Testing,VAVE,Process Planning,QTP,Test Report Analysis",,,"{""min_degree"": ""Bachelor"", ""fields"": [""Engineering"", ""Related Major""]}","{""max"": 0, ""min"": 0}",Affirmative Action/EEO employer
