task_id,keyword,location,job_id,company,title,created_on,description,url,summary,industries,soft_skills,hard_skills,tech_stack,programming_languages,education,salary,benefits
b186df715a3a4aa8b534d07ce3c293a1,Data Scientist,"Dearborn, MI",3966686189,Stefanini Group,Machine Learning Engineer,1720579597.6880457,"Details: Job Description Stefanini Group is hiring! Stefanini is looking for a Machine Learning Engineer, Location: Dearborn, MI (Hybrid) For quick apply, please reach out Pawan Rawat at 248-213-3605/pawansingh.rawat@stefanini.com Open to W2 candidates only! We also believe in providing you with the freedom to define and realize your dreams. With our incredible plans for the future of mobility, we have a wide variety of opportunities for you to accelerate your career potential as you help us define tomorrow's transportation. Global Data Insight & Analytics organization is looking for a Machine Learning Engineer focused on building and driving the strategy forward for our internal Data Science / AI/ML platform. This role will work in a small, cross-functional team. The position will collaborate directly and continuously with other engineers, business partners, product managers and designers, and will release early and often. The team you will be working on is focused on building Mach1ML platform - an AI/ML enablement platform to democratize Machine Learning across enterprise (similar to Uber's Michelangelo, Facebook's FBLearner, etc). Position Responsibilities: Work closely with Tech Anchor, Product Manager and Product Owner to deliver MLOPs platform and Gen AI solution in GCP using Python and other tools for the data scientists and business across the company. Work with software and ML engineers/Data Scientist to tackle challenging AIOps and Gen AI problems. Maintain and mange current CI/CD ecosystem and tools Find ways to automate and continually improve current CI/CD processes and release processes Examine, inspect codes / scripts and resolve issues Help innovate standardize machine learning development practices. Experiment, innovate and share knowledge with the team. Lead by example in use of Paired Programming for cross training/upskilling, problem solving, and speed to delivery. Leverage latest ML/Gen AI / GCP/AIOPs/Kubernetes technologies Job Requirements Details: Skills Required: A Bachelor's degree in Computer Science / Computer Engineering or similar technical discipline. 3+ years of work experience as a backend software engineer in Python with exceptional software engineering knowledge. 2+ years of experience with Cloud Engineering / Services Experience with ML workflow orchestration tools: Airflow, Kubeflow etc. Advanced working knowledge of object-oriented/object function programming languages: Python, C/C++ Experience/understanding in MLOPs and Gen AI is a big plus Experience in DevOps: Jenkins/Tekton etc. Experience with cloud services, preferably GCP Services like Vertex AI, Cloud Function, BigQuery etc. Experience in container management solution: Kubernetes, Docker Experience in scripting language: Bash, PowerShell etc. Experience with Infrastructure as code: Terraform etc Experience Required: A Bachelor's degree in Computer Science / Computer Engineering or similar technical discipline. 3+ years of work experience as a backend software engineer in Python with exceptional software engineering knowledge. 2+ years of experience with Cloud Engineering / Services Experience with ML workflow orchestration tools: Airflow, Kubeflow etc. Advanced working knowledge of object-oriented/object function programming languages: Python, C/C++ Experience/understanding in MLOPs and Gen AI is a big plus Experience in DevOps: Jenkins/Tekton etc. Experience with cloud services, preferably GCP Services like Vertex AI, Cloud Function, BigQuery etc. Experience in container management solution: Kubernetes, Docker Experience in scripting language: Bash, PowerShell etc. Experience with Infrastructure as code: Terraform etc Skills Preferred: Master focused in Computer Science / Machine Learning or related field Experience working with Google Cloud platform(GCP) - specifically Google Kubernetes engine, Terraform, and infrastructure Experience in programming concepts such as Paired Programming, Test Driven Development, etc. Knowledge of coding and software craftsmanship practices. Must be a quick learner and open to learning new technology. Experience applying agile practices to solution delivery. Must be team-oriented and have excellent oral and written communication skills. Must be a self-starter to understand existing bottlenecks and come up with innovative solutions. Experience Preferred: Experience and good understanding of GCP, DevOPs, AI/ML and GEN AI Education Required: A Bachelor's degree in Computer Science / Computer Engineering or similar technical discipline. Listed salary ranges may vary based on experience, qualifications, and local market. Also, some positions may include bonuses or other incentives*** Stefanini takes pride in hiring top talent and developing relationships with our future employees. Our talent acquisition teams will never make an offer of employment without having a phone conversation with you. Those face-to-face conversations will involve a description of the job for which you have applied. We also speak with you about the process including interviews and job offers. About Stefanini Group The Stefanini Group is a global provider of offshore, onshore and near shore outsourcing, IT digital consulting, systems integration, application, and strategic staffing services to Fortune 1000 enterprises around the world. Our presence is in countries like the Americas, Europe, Africa, and Asia, and more than four hundred clients across a broad spectrum of markets, including financial services, manufacturing, telecommunications, chemical services, technology, public sector, and utilities. Stefanini is a CMM level 5, IT consulting company with a global presence. We are CMM Level 5 company.",https://www.linkedin.com/jobs/view/3966686189,"Stefanini Group is looking for a Machine Learning Engineer to build and drive the strategy for their internal Data Science / AI/ML platform. This role will work in a small, cross-functional team, collaborating with other engineers, business partners, product managers and designers. The team is focused on building the Mach1ML platform, an AI/ML enablement platform to democratize Machine Learning across the enterprise. The ideal candidate will have 3+ years of experience as a backend software engineer in Python, 2+ years of experience with Cloud Engineering/Services, experience with ML workflow orchestration tools (Airflow, Kubeflow), and experience with GCP Services (Vertex AI, Cloud Function, BigQuery).","Information Technology,Software Development,Data Science,Artificial Intelligence,Machine Learning,Cloud Computing,Automotive","Collaboration,Communication,Problem Solving,Teamwork,Quick Learner,Self-Starter,Innovation,Leadership,Analytical,Communication,Problem Solving,Teamwork","Python,C/C++,Airflow,Kubeflow,Jenkins,Tekton,GCP,Vertex AI,Cloud Function,BigQuery,Kubernetes,Docker,Bash,PowerShell,Terraform","Python,Airflow,Kubeflow,GCP,Vertex AI,Cloud Function,BigQuery,Kubernetes,Docker,Terraform,Jenkins,Tekton","Python,C/C++,Bash,PowerShell","{""min_degree"": ""Bachelor's degree"", ""fields"": [""Computer Science"", ""Computer Engineering""]}","{""max"": 0, ""min"": 0}",
b186df715a3a4aa8b534d07ce3c293a1,Data Scientist,"Ann Arbor, MI",3955720424,GyanSys Inc.,MLOps Engineer,1720579601.9555764,"GyanSys is looking for MLOps Engineer for its direct client on C2C. This is hybrid role . Please share consultants only on your W2. Location: Ann Arbor, Michigan Azure ML and related Azure technologies Strong programming skills in languages such as Python, Java, or Scala Responsibilities: • Design, implement, and maintain end-to-end machine learning pipelines for model training, validation, and deployment. • Collaborate with data scientists, software engineers, and DevOps engineers to integrate machine learning models into production systems. • Develop automation tools and frameworks to streamline the machine learning workflow, including data preprocessing, feature engineering, model training, and evaluation. • Optimize model performance and scalability by leveraging cloud computing resources and distributed computing techniques. • Implement monitoring and logging solutions to track model performance, data quality, and system health in production. • Manage model versioning, experimentation, and reproducibility using version control systems and experiment tracking tools. • Stay up to date with the latest trends and technologies in machine learning, cloud computing, and software engineering, and incorporate them into the MLOps workflow. • Provide technical guidance and mentorship to junior team members on best practices for MLOps. Required Skillset: • Strong programming skills in languages such as Python, Java, or Scala. • Proven experience as an MLOps Engineer , specifically with Azure ML and related Azure technologies . • Familiarity with containerization technologies such as Docker and orchestration tools like Kubernetes . • Proficiency in automation tools like JIRA, Ansible, Jenkins, Docker compose, Artifactory, etc . • Knowledge of DevOps practices and tools for continuous integration, continuous deployment (CI/CD), and infrastructure as code (IaC). Bachelor's degree or higher in computer science, engineering, mathematics, or related field. About GyanSys GyanSys Inc is a global systems integrator & solutions provider focused on providing strategic business process, technology, platform, and managed service solutions. As a recognized innovator in digital and process transformation, we specialize in SAP and Salesforce implementations, managed services, and analytics. We integrate cutting edge solutions in complex multi-cloud environments to optimize operations and to maximize return on investment. With over 1500 consultants, we are headquartered in Indianapolis USA, with delivery centers in Bangalore, India and Manilla, Philippines.",https://www.linkedin.com/jobs/view/3955720424,"GyanSys is seeking an experienced MLOps Engineer to design, implement, and maintain end-to-end machine learning pipelines for model training, validation, and deployment within Azure ML. The role involves collaboration with data scientists, software engineers, and DevOps engineers to integrate ML models into production systems. The ideal candidate will have strong programming skills in Python, Java, or Scala, experience with Azure ML and related technologies, knowledge of containerization (Docker, Kubernetes), automation tools (JIRA, Ansible, Jenkins, Docker Compose, Artifactory), DevOps practices, and CI/CD pipelines.  A bachelor's degree in a related field is required.","Information Technology,Software Development,Cloud Computing,Machine Learning,Data Science","Collaboration,Communication,Problem-solving,Technical Guidance,Mentorship","Python,Java,Scala,Azure ML,Azure Technologies,Docker,Kubernetes,JIRA,Ansible,Jenkins,Docker Compose,Artifactory,DevOps,CI/CD,Infrastructure as Code (IaC)","Azure ML,Azure Technologies,Docker,Kubernetes,JIRA,Ansible,Jenkins,Docker Compose,Artifactory","Python,Java,Scala","{""min_degree"": ""Bachelor's Degree"", ""fields"": [""Computer Science"", ""Engineering"", ""Mathematics""]}","{""max"": 0, ""min"": 0}",
b186df715a3a4aa8b534d07ce3c293a1,Data Scientist,Detroit Metropolitan Area,3952875309,Little Caesars Pizza,Software Engineer (REACT),1720579607.0389068,"Your Mission: You work on a team building and maintaining the custom software which runs Little Caesars. Whether remote or on site, you will be part of all aspects of the Software Development Lifecycle including technical design, development, testing and support. Focus on deepening expertise in one area of software development technology. This position will operate with guidance, when needed, from more experienced levels of Engineers. This position may support LCE or other Ilitch companies. What You Will Do: Participate in the design, development, and support of technical projects through to completion according to project and corporate standards and methodologies. Responsible for the individual delivery of specific tasks as well as for the delivery of components of large projects as part of a team with minimal oversight and mentoring from more senior developers. Translate user stories into clear code Craft code which is free of obvious or glaring errors as well as reliably free of more subtle edge-case errors Analyze, navigate, and understand large code bases and effectively debug others’ code Understand the existing designs and technology choices within your area, and make appropriate adjustments to existing designs when necessary Create and maintaining unit tests Participate in all aspects of agile software development including sprint-planning, story review and demos. Play an active role in estimation and sprint planning. Regularly pair with both more junior and more senior developers while completing development assignments. Provide guidance to engineers and analysts with less experience. Support Quality Assurance (QA) in the development of integration test plans, test conditions, and expected test results. Work collaboratively with Product Owners on the development of user stories to ensure they include appropriate details. Resolve system issues and respond to suggestions for improvements. Provide support for production applications including on-call afterhours support on a rotational basis. Develop and maintain support documentation. Perform research and technical analysis on existing systems. Identify deficiencies or alternatives and present proposals to more senior engineers. Take part in the research and proof-of-concepts of new technologies. Present findings to senior technologists in the organization. Establish one or more areas of technology in which to strive to become a SME. Take responsibility of and perform technical tasks which support the overall software development team such as: Performing builds and releases Working on software pipelines Performing pull-request reviews of others’ work Assisting with the on-boarding of new colleagues Understand the design and architectural direction of software projects. Decompose a simple problem or business scenario into a solution. Who You Are: Bachelor’s degree in Computer Science or related field. Equivalent experience may be considered in lieu of a formal education. Minimum of three (3) years of programming experience in a professional environment. Evidence of strong analytical skills and evidence of ability to develop solutions and alternatives that meet business goals. Strong relationship building skills and ability to collaborate with other IT staff and business units. Effective verbal and written communication skills with the ability to listen and communicate technical information. Evidence of a self-motivated, curious and creative approach to technology with a passionate embrace of technology. Experience in the technologies required for the role. In general, a Software Engineer II is expected to have strong knowledge in one of the following technologies: HTML / JavaScript / CSS/ React / TypeScript Node.js Open-source JavaScript libraries REST APIs Azure cloud platform or equivalents such as AWS or GCP Experience developing software within team using formal processes and methodologies such as Agile approaches using a tool such as DevOps or Jira. Experience using source control technologies such as GIT. What Will Make You Stand Out: Experience building or building to RESTful APIs. Understanding of one or more programming paradigms such as Object Oriented Programming (OOP), functional programming, or dependency injection. Where You Will Work: This position requires on-call responsibilities requiring work during nights, weekends, or holidays. Works in a normal office environment where there is no physical discomfort due to temperature, noise, dust and the like. Moderate noise (examples: business office with computers and printers. Some travel including travel to restaurant locations and trade shows. This position requires the ability to adhere to the LCE Travel policy.",https://www.linkedin.com/jobs/view/3952875309,"This role involves software development for Little Caesars, encompassing the full SDLC (design, development, testing, support). The ideal candidate has 3+ years of experience, a strong understanding of one of the listed tech stacks, and a passion for technology. This position offers opportunities for growth and specialization in a particular technology area.","Food Service,Retail,Software Development,Technology","Analytical Skills,Problem Solving,Collaboration,Communication,Relationship Building,Self-Motivation,Creativity,Passion for Technology","Technical Design,Development,Testing,Support,Software Development Lifecycle,Agile Development,Sprint Planning,Story Review,Demos,Estimation,Pair Programming,Code Review,Unit Testing,Integration Testing,User Story Development,Issue Resolution,Production Support,Documentation,Technical Analysis,Research,Proof-of-Concepts,Builds,Releases,Software Pipelines,Onboarding","HTML,JavaScript,CSS,React,TypeScript,Node.js,Open-source JavaScript libraries,REST APIs,Azure cloud platform,AWS,GCP,DevOps,Jira,GIT","JavaScript,TypeScript","{""min_degree"": ""Bachelor's degree"", ""fields"": [""Computer Science"", ""Related Field""]}","{""max"": 0, ""min"": 0}",
b186df715a3a4aa8b534d07ce3c293a1,Data Scientist,"Michigan, United States",3928447041,Autodesk,Machine Learning Engineer,1720579610.251231,"Job Requisition ID # 24WD78705 Position Overview Do you thrive in an environment where you can work on engaging and challenging projects? Do you have a start-up mentality? Every year Autodesk hires talented engineers to join our global teams and benefit from unlimited access to our technology and industry mentors. If this sounds like you… let's talk. We are growing our Enterprise AI team within the Enterprise Systems & Experience organization to enhance the company's IT systems, applications, and processes with AI technologies. Our engineering culture will empower you to make effective decisions, work collaboratively, and take accountability for engineering projects at the company's core. Our team is seeking a highly motivated and experienced Machine Learning Engineer to join our team. As a Machine Learning Engineer, you will be responsible for building and deploying the AI models needed for our projects. You will work closely with our data engineers to ensure that our AI solutions are accurate, efficient, and scalable. Responsibilities Deploy machine learning models for our AI solutions Collaborate with data engineers and data scientists to ensure that data is available and accessible for model development and deployment Optimize machine learning models for accuracy, efficiency, and scalability Develop and maintain code for model training, testing, and deployment Work closely with other teams to integrate machine learning models into our AI solutions Monitor and troubleshoot machine learning models to ensure accuracy and performance Develop and maintain documentation for machine learning models and code Minimum Qualifications Master's degree in Machine Learning, Computer Science, Applied Artificial Intelligence, or a related field 5+ years of backend or infrastructure experience 3+ years of hands-on experience in one or more of the following areas: machine learning, machine learning infrastructure, data infrastructure Proven experience deploying ML models and implementing the full lifecycle of model development. Strong programming skills in Python, and machine learning libraries such as Pandas, as well as Jupyter Notebooks Experience with PyTorch, TensorFlow, PyTorch, and and/or natural language processing using NLTK, spaCy, etc Machine Learning expertise in NLP ranking, recommendations, and/or classification algorithms Familiarity with cloud computing platforms such as AWS, Azure, or Google Cloud Experience working with RAG technologies such as LLM frameworks (Langchain or LLamaIndex), LLM model registries, embedding models, prompting techniques, and vector databases. Preferred Qualifications Experience with Kubernetes/Container resources for deployments Experience in building AI/ML solutions and platforms with models in production, ML Ops, CI/CD automation of ML pipelines in a cloud-based environment (AWS, Azure, GCP) The Ideal Candidate Understand business objectives and develop models that help to achieve them, along with metrics to track their progress. Deals well with ambiguous or undefined problems; ability to think abstractly Comfortable performing requirements analysis, interfacing with stakeholders of various levels and documenting solutions Excellent interpersonal skills Ability to articulate technical topics to non-technical audiences both in writing and using diagrams Energetic team player who works well across boundaries and readily adapts to change and enjoys rapid development Confident of your skills, abilities and willing to share what you know, while learning from others Learn More About Autodesk Welcome to Autodesk! Amazing things are created every day with our software – from the greenest buildings and cleanest cars to the smartest factories and biggest hit movies. We help innovators turn their ideas into reality, transforming not only how things are made, but what can be made. We take great pride in our culture here at Autodesk – our Culture Code is at the core of everything we do. Our values and ways of working help our people thrive and realize their potential, which leads to even better outcomes for our customers. When you’re an Autodesker, you can be your whole, authentic self and do meaningful work that helps build a better future for all. Ready to shape the world and your future? Join us! Benefits From health and financial benefits to time away and everyday wellness, we give Autodeskers the best, so they can do their best work. Learn more about our benefits in the U.S. by visiting https://benefits.autodesk.com/ Salary transparency Salary is one part of Autodesk’s competitive compensation package. For U.S.-based roles, we expect a starting base salary between $119,800 and $206,690. Offers are based on the candidate’s experience and geographic location, and may exceed this range. In addition to base salaries, we also have a significant emphasis on annual cash bonuses, commissions for sales roles, stock grants, and a comprehensive benefits package. Equal Employment Opportunity At Autodesk, we're building a diverse workplace and an inclusive culture to give more people the chance to imagine, design, and make a better world. Autodesk is proud to be an equal opportunity employer and considers all qualified applicants for employment without regard to race, color, religion, age, sex, sexual orientation, gender, gender identity, national origin, disability, veteran status or any other legally protected characteristic. We also consider for employment all qualified applicants regardless of criminal histories, consistent with applicable law. Diversity & Belonging We take pride in cultivating a culture of belonging and an equitable workplace where everyone can thrive. Learn more here: https://www.autodesk.com/company/diversity-and-belonging Are you an existing contractor or consultant with Autodesk? Please search for open jobs and apply internally (not on this external site).",https://www.linkedin.com/jobs/view/3928447041,"Autodesk is seeking a Machine Learning Engineer to join their Enterprise AI team. The role involves building and deploying AI models, working with data engineers, optimizing models for accuracy and scalability, and collaborating with other teams to integrate ML models into AI solutions. The ideal candidate will have strong Python programming skills, experience with machine learning libraries like Pandas, PyTorch, TensorFlow, and NLP tools, and familiarity with cloud platforms like AWS, Azure, or Google Cloud. Additional experience with Kubernetes, ML Ops, and CI/CD automation in a cloud environment is preferred.","Software,Technology,Artificial Intelligence,Machine Learning,Cloud Computing","Collaboration,Communication,Problem Solving,Critical Thinking,Decision Making,Accountability,Interpersonal Skills,Adaptability,Teamwork,Time Management,Organization,Detail-Oriented,Analytical Skills,Communication,Documentation,Leadership","Python,Pandas,Jupyter Notebooks,PyTorch,TensorFlow,NLTK,spaCy,NLP Ranking,Recommendations,Classification Algorithms,AWS,Azure,Google Cloud,RAG Technologies,LLM Frameworks (Langchain or LLamaIndex),LLM Model Registries,Embedding Models,Prompting Techniques,Vector Databases,Kubernetes,ML Ops,CI/CD,Cloud-Based Environments","Python,Pandas,Jupyter Notebooks,PyTorch,TensorFlow,NLTK,spaCy,AWS,Azure,Google Cloud,Langchain,LlamaIndex,Kubernetes,ML Ops,CI/CD",Python,"{""min_degree"": ""Master's degree"", ""fields"": [""Machine Learning"", ""Computer Science"", ""Applied Artificial Intelligence""]}","{""max"": 206690, ""min"": 119800}","Health Benefits,Financial Benefits,Time Away,Wellness Programs"
