task_id,keyword,location,job_id,company,title,created_on,description,url,summary,industries,soft_skills,hard_skills,tech_stack,programming_languages,education,salary,benefits
b186df715a3a4aa8b534d07ce3c293a1,Data Scientist,"Dearborn, MI",3948471861,Ford Motor Company,Data Scientist,1720579539.5127208,"Job Description At Ford Motor Company, we believe freedom of movement drives human progress. With our incredible plans for the future of mobility, we have a wide variety of opportunities for you to accelerate your career and help us define tomorrow’s transportation. Do you believe data tells the real story? We do! Redefining mobility requires quality data, metrics and analytics, as well as insightful interpreters and analysts. That's where Global Data Insight & Analytics makes an impact. We advise leadership on business conditions, customer needs and the competitive landscape. With our support, key decision makers can act in meaningful, positive ways. Join us and use your data expertise and analytical skills to drive evidence-based, timely decision making. The Strategy & Enterprise Analytics team under Connected Vehicle & Enterprise Analytics organization in GDI&A is seeking an experienced Data Scientist with a strong background in AI/ML to develop and deliver innovative data analytics models, tools, and services. As a key member of our team, you will collaborate with business partners to identify new data sources and explore their potential use in driving business results. About Us: In Global Data, Insight & Analytics (GDI&A), we harness the power of data and artificial intelligence to navigate Ford Motor Company through the disruptiveness of the information age. We're a team of innovators who strive to realize the enterprise's goals, reveal hidden opportunities, and achieve data superiority. Responsibilities About You: We're looking for a seasoned Data Scientist with 3+ years of experience in AI/ML, preferably with some experience in Generative AI. You're a humble and collaborative individual who thrives in a fast-paced environment. You're passionate about developing and delivering data analytics and machine learning models that drive business impact. What you’ll be able to do : Acquire deep understanding of the business problems and translate them into appropriate business solutions Act as full stack data scientist to develop and deliver advanced analytics models, including classification, time series, LLM, and more Collaborate internally and externally to identify new and novel data sources and explore their potential use in developing actionable business results Work independently with minimal guidance, taking ownership of projects and delivering results Foster a collaborative team environment, showing highest respect for team members and their contributions Demonstrate curiosity about data, seeking to understand its underlying patterns and relationships Ensure high-quality data and solutions throughout the development process Communicate analytical results effectively to various audiences Qualifications The minimum requirements we seek : Master's degree in Data Science, Computer Science or a related quantitative field 3+ years of experience in AI/ML, preferably with some experience in Generative AI Strong skills in data acquisition, algorithm design, model development, and refinement Experience with big data technologies, cloud-based data platforms (e.g., GCP, AWS), and business intelligence tools (e.g., Qlik Sense, Looker, Streamlit, Dash) Excellent oral, written, and interpersonal communication skills Ability to work collaboratively and drive results in a fast-paced environment Our preferred requirements : Ph.D degree in Data Science, Computer Science or a related quantitative field Experience in Generative AI Experience in legal or regulatory domains 5+ years of experience in data science and analysis, including full-time work and research/academia experience Certifications in Google Cloud Platform (GCP) or other cloud platforms Experience with deep learning frameworks (e.g., TensorFlow, PyTorch), NLP, and large-scale optimization Publications or presentations in recognized journals or conferences Experience with agile development methodologies and version control systems (e.g., Git) What you’ll receive in return : As part of the Ford family, you’ll enjoy excellent compensation and a comprehensive benefits package that includes generous PTO, retirement, savings, and stock investment plans, incentive compensation, and much more. You’ll also experience exciting opportunities for professional and personal growth and recognition. Candidates for positions with Ford Motor Company must be legally authorized to work in the United States. Verification of employment eligibility will be required at the time of hire. Visa sponsorship is available for this position. We are an Equal Opportunity Employer committed to a culturally diverse workforce. All qualified applicants will receive consideration for employment without regard to race, religion, color, age, sex, national origin, sexual orientation, gender identity, disability status, or protected veteran status. For information on Ford's salary and benefits, please visit: https://corporate.ford.com/content/dam/corporate/us/en-us/documents/careers/2024-benefits-and-comp-GSR-sal-plan-2.pdf",https://www.linkedin.com/jobs/view/3948471861,"Ford Motor Company seeks a seasoned Data Scientist with 3+ years of experience in AI/ML, preferably with some experience in Generative AI, to develop and deliver innovative data analytics models, tools, and services. The role involves collaborating with business partners to identify new data sources, translating business problems into solutions, and working independently to deliver results. Strong skills in data acquisition, algorithm design, model development, and refinement are essential, along with experience with big data technologies, cloud-based data platforms (e.g., GCP, AWS), and business intelligence tools (e.g., Qlik Sense, Looker, Streamlit, Dash).","Automotive,Data Analytics,Artificial Intelligence,Machine Learning,Technology","Collaboration,Communication,Problem Solving,Teamwork,Leadership,Analytical Thinking,Curiosity","Data Acquisition,Algorithm Design,Model Development,Data Refinement,Big Data Technologies,Cloud-based Data Platforms,Business Intelligence Tools,Generative AI,Time Series Analysis,LLM,Classification,Deep Learning,TensorFlow,PyTorch,NLP,Large-Scale Optimization,Agile Development,Version Control,Git","GCP,AWS,Qlik Sense,Looker,Streamlit,Dash,TensorFlow,PyTorch,Git",Python,"{""min_degree"": ""Master's degree"", ""fields"": [""Data Science"", ""Computer Science"", ""Quantitative Fields""]}","{""max"": 0, ""min"": 0}","PTO,Retirement,Savings,Stock Investment Plans,Incentive Compensation"
b186df715a3a4aa8b534d07ce3c293a1,Data Scientist,"Brighton, MI",3957619052,Lifelancer,Data Scientist,1720579543.2239158,"MPB customers come from all walks of life, and so do we. We are an Equal Opportunity Employer and do not discriminate against any employee or applicant because of family makeup, race, sexuality, religion, gender identity, disability or age. At MPB, every employee has the opportunity to make an impact and grow. The Opportunity: In this role, you will be working alongside the Senior Data Scientist to scale and elevate our current and future Data Science Data Products. Key Responsibilities: Immerse yourself in our Pricing Optimization model approach. Help build improvements and understand, troubleshoot, and maintain the end-to-end process. Hands-on machine learning model development. Understand the nuances of the data gathering process and make modelling and data processing choices considerate of this. Own and contribute to our Data Science products. Suggest techniques, feature engineering, and deployment improvements. Collaborate effectively within a modern DS team using JIRA and version control best practices. Explore new Data Science opportunities. Conduct experiments, adapt approaches, and ensure scalability and deliverability Produce accessible and digestible outputs from ML products. This could be presenting findings in an accessible and concise way, designing Tableau dashboards to surface interactive predictions, delivering batch predictions or building API endpoints to serve online inference. Who you are: Someone who already has a good theoretical background in Data Science techniques with a broad understanding of the most common approaches Ideally, you will have some commercial experience with an eagerness to learn and adapt in a fast-paced environment. You will apply critical thinking, design thinking, and pragmatism in this role. Someone who takes ownership of their projects and brings creativity, flexibility and enthusiasm to improving the deliverables Required Skills: A solid understanding of the breadth of Data Science techniques and which are more appropriate for different types of business problems. Good competency in Python and SQL essential. Familiarity with different ways of working with Python and data desirable - e.g. virtual environment and dependency management, writing scripts and programs vs coding in Jupyter notebooks, working locally vs in cloud vm. Competency in transferable software engineering techniques like version control, CICD, software design patterns desirable. Familiarity with common ML packages, particularly scikit-learn and XGBoost or similar. Deep learning experience (e.g. Pytorch or Tensorflow) beneficial but not required Relentless appetite to learn and adapt techniques to business context. Prioritising adding value when shortlisting approaches. A focus on efficient data problem solving, be keen to deploy the most effective solution for the opportunity and have maturity in deciding where effort is spent Familiarity with GCP or alternatives like AWS highly desirable, bonus points for MLOPs elements such as vertex and cloud functions. Demonstrate a good understanding of the end to end deployment and management of Data Science products such as models. Ideally have experience owning or significantly contributing to production DS products but understanding the theoretical approach also valid with a desire to learn Great communication skills essential - be able to present outputs and updates of projects to varied audiences, adapt communication style and have influence over the stakeholders Please use the below link for job application and quicker response. https://lifelancer.com/jobs/view/6769b1ef140d46f876bb68dca035e015",https://www.linkedin.com/jobs/view/3957619052,"MPB is seeking a Data Scientist to work alongside the Senior Data Scientist to scale and elevate their current and future Data Science Data Products. The role involves working on Pricing Optimization models, hands-on machine learning model development, owning and contributing to Data Science products, exploring new opportunities, and producing accessible outputs from ML products.","Data Science,Technology,E-commerce,Retail","Critical thinking,Design thinking,Pragmatism,Ownership,Creativity,Flexibility,Enthusiasm,Communication,Influence,Collaboration","Pricing Optimization,Machine Learning,Data Gathering,Feature Engineering,Deployment,JIRA,Version Control,Experimentation,Scalability,Tableau,Data Visualization,API Development,Python,SQL,Virtual Environments,Dependency Management,Jupyter Notebooks,Cloud Computing,Software Engineering,Version Control,CICD,Software Design Patterns,Scikit-learn,XGBoost,Deep Learning,Pytorch,Tensorflow,GCP,AWS,MLOps,Vertex,Cloud Functions,Model Deployment,Model Management,Production Data Science","Python,SQL,JIRA,Tableau,Scikit-learn,XGBoost,Pytorch,Tensorflow,GCP,AWS,Vertex,Cloud Functions","Python,SQL","{""min_degree"": null, ""fields"": [""Data Science"", ""Computer Science"", ""Statistics"", ""Mathematics""]}","{""max"": 0, ""min"": 0}",
b186df715a3a4aa8b534d07ce3c293a1,Data Scientist,"Owosso, MI",3948095700,Covenant Eyes,Data Scientist I,1720579546.98185,"We're looking for a talented and highly motivated Data Scientist. Living and working in a culture that is more concerned about personal privacy than personal accountability presents great challenges for us and, most importantly, for our members. This is also true with the technology stacks we all use every day, especially the ones that sit right in our pockets. This landscape presents great challenges for us and we need great people with the talent, skill, and desire to take on those challenges. Someone looking to make a positive impact that has an eye toward innovation. Pornography is corrupting hundreds of millions of people. Our goal is to change culture such that people can break free from pornography or never start using it. We don't need ""just a Data Scientist."" We need someone to build innovative solutions with us that are effective in helping to free people from pornography, work to rebuild trust, and make families strong. One person at a time. One family at a time. You will be joining a highly skilled team of development and quality assurance staff and collaborate regularly with UI/UX designers to build and expand our applications and services. A team that focuses on providing solutions to optimize performance, scalability, security protocols, and reporting capabilities. A team that is committed to personal and professional growth, learning new technologies, and a passion for excellence. We're picky about who we bring into the Covenant Eyes family. We're looking for people who are picky about the family they join. If that excites you, we would love to hear from you! Summary The Data Scientist - Reporting utilizes state-of-the-art data engineering, data science, and business intelligence modeling, analysis, and reporting tools, systems and processes to develop, build, and maintain solutions that serve as the backbone of the Covenant Eyes Accountability Report. The Data scientist works closely with business stakeholders to understand their goals and determine how data can be used to achieve those goals. They design data modeling processes, create algorithms and predictive models to extract the data the business needs. The Data Scientist works with emotionally taxing and ethically complex data and must be aware pf the psychological impacts these data sets may have on team members. Essential Duties Work collaboratively with stakeholders throughout the organization to identify opportunities for leveraging data to drive reporting solutions. Mine and analyze data to drive optimization and improvement of reporting accuracy and clarity. Assess the effectiveness and accuracy of new data sources and data gathering techniques in order to continue to deliver clear and effective data to our customers. Develop custom data models and algorithms to apply to data sets to better our reporting accuracy based on Product vision. Coordinate and collaborate with different functional teams to implement models and monitor outcomes to support company goals Develop processes and tools to monitor and analyze model performance and data accuracy. Work with the Data Science team of developers, rating specialists, and management to support the goals of Data Science in Tech and at Covenant Eyes. Bachelor’s degree in Data Science, Statistics, Mathematics, Computer Science or another quantitative field. Strong problem-solving skills. Experience using statistical computer languages (R, Python, SLQ, etc.) to manipulate data and draw insights from large data sets. Knowledge of a variety of machine learning techniques (clustering, decision tree learning, artificial neural networks, etc.) and their real-world advantages/drawbacks. Knowledge of advanced statistical techniques and concepts (regression, properties of distributions, statistical tests and proper usage, etc.) and experience with applications. Excellent written and verbal communication skills for coordinating across teams. Ability to connect data science solutions to their human impact on our members. A drive to learn and master new technologies and techniques. Most of your time will be spent at a desk using a phone, computer and monitor, and general office equipment. You may be required to reach with hands and arms; sit; stand; talk and hear; use your hands to finger, handle, or feel.",https://www.linkedin.com/jobs/view/3948095700,"The Data Scientist - Reporting role at Covenant Eyes focuses on leveraging data science and business intelligence to develop, build, and maintain reporting solutions. This role involves working with stakeholders to understand their data needs, designing data modeling processes, creating algorithms and predictive models, and ensuring the accuracy and effectiveness of reporting. The ideal candidate will possess strong problem-solving skills, experience with statistical computer languages (R, Python, SQL), knowledge of machine learning techniques and advanced statistical concepts, and excellent communication skills.","Data Science,Business Intelligence,Technology,Non-Profit","Problem-solving,Communication,Collaboration,Data Analysis,Critical Thinking,Analytical Skills,Attention to Detail","Data Science,Statistics,Mathematics,Computer Science,R,Python,SQL,Machine Learning,Clustering,Decision Tree Learning,Artificial Neural Networks,Regression,Statistical Tests","R,Python,SQL,Machine Learning","R,Python,SQL","{""min_degree"": ""Bachelor\u2019s degree"", ""fields"": [""Data Science"", ""Statistics"", ""Mathematics"", ""Computer Science""]}","{""max"": 0, ""min"": 0}",
b186df715a3a4aa8b534d07ce3c293a1,Data Scientist,"Auburn Hills, MI",3941390332,Whisker,Data Scientist,1720579548.4855945,"Description Whisker, is the maker of Litter-Robot, Feeder-Robot, and Litterbox.com. At Whisker, we believe pet parenthood can always get better. As leading innovators in pet tech and refined pet accessories, we work tirelessly to solve problems and deliver smarter insights for pet parents while enriching the lives of pets. Whether it’s a self-cleaning litter box that automates scooping, an automatic feeder that helps pets develop healthier eating habits, or a modern cat tree that delights both humans and felines, we strive to deliver better solutions for consumers while transforming pet care along the way. To us, having a pet is the best thing ever. At Whisker, life together just keeps getting better. Whisker is based in Auburn Hills, Michigan and Juneau, Wisconsin with 500+ passionate team members. What You’ll Do : The Data Scientist II will play a pivotal role in Whisker’s data-driven decision-making process and will be responsible for leading and executing complex data science projects, utilizing expertise in statistical analysis, machine learning, and data modeling. The Data Scientist’s deep understanding of data extraction, manipulation, and interpretation will contribute to the development of innovative solutions that drive business growth and optimize operations. Essential Duties and Responsibilities: This list of duties and responsibilities is not all-inclusive and may be expanded to include other duties and responsibilities as deemed necessary. Data Analysis and Modeling : Applies advanced statistical techniques and machine learning algorithms to analyze large datasets, uncover patterns, trends, and insights, and builds predictive models Collaborates with cross-functional teams to extract meaningful business implications from the data Project Leadership : Takes the lead on data science initiatives, from inception to completion Defines project scopes, sets milestones, and allocates resources effectively to ensure timely and accurate delivery of solutions Machine Learning and AI : Develops, implements, and optimizes machine learning algorithms to solve complex business problems Ideates and executes on projects that involve natural language processing, computer vision, recommendation systems, and other cutting-edge technologies Identifies and architects ETL data subsystems to prepare data for analysis and training Data Visualization: Communicates findings and results effectively through clear and compelling data visualizations, making complex concepts accessible to both technical and non-technical stakeholders Model Deployment: Collaborates with software engineering teams to integrate machine learning models into both production and internal systems, ensuring scalability, performance, and maintainability Data Governance and Ethics: Upholds data governance principles and adheres to ethical practices while handling sensitive and confidential data Mentorship and Knowledge Sharing: Provides guidance and mentorship to junior data scientists, fostering their growth and development Contributes to the organization's knowledge base by sharing insights, best practices, and emerging trends in the data science field Continuous Learning: Stays updated on the latest advancements in data science, machine learning, and related fields, and identifies opportunities to apply new methodologies to existing projects Requirements Will perform additional responsibilities when required What You’ll Bring : BA / BS / MS Degree in Math, Statistics, Computer Science or equivalent years of experience 3+ years in a Data Engineering, Data Science Role 3+ years experience in an e-Commerce, direct-to-consumer company, including familiarity working with customer data (lifetime value, customer acquisition cost, churn rate) Experience with data engineering patterns and an ability to stand up new data pipelines Experience with ETL fundamentals and building efficient data pipelines (Glue, EMR, Spark) Experience with relational SQL and NoSQL databases, including RDS, DynamoDB, PostgreSQL Experience with cloud services: Cloud (AWS) experience with object-oriented programming (Python) Comfortable working with common ML/DL libraries (Pandas, Numpy, Scikit-Learn, Tensorflow, Pytorch, MXNet, StatsModels) Maintains confidentiality of proprietary information Ability to maintain a professional atmosphere in a fast-paced environment with numerous interactions and interruptions A high degree of initiative, self-motivation, and ability to motivate others Ability to establish and maintain cooperative working relationships with Team Members and colleagues Not Required but Nice to Have! Current or previous pet parent Experience implementing a production data pipeline, at scale on a live, customer-facing product, from the ground up Experience with the BI tool, Domo Experience working in an Agile environment Benefits & Purrks: Join a tenacious, inventive company that empowers team members to chart their own path, lead by grounding decisions in the “why”, and has a strong sense of empathy and openness to new perspectives. Be a part of exciting growth, work with incredible people, and create tomorrow’s pet products—plus a whole lot of extras. You will also be provided with: Premium Medical/Dental/Vision insurance Paid parental leave Whisker Parents Program 1 day ""pawternity"" leave for new pet adoption Pet Insurance 401K match Flexible spending accounts Company-paid short-term disability and life insurance Employee Assistance Program (EAP) Generous paid time off 14 Paid Holidays Top of the line equipment Pet-friendly office Whisker products and swag Continuing education support On-site gym with peloton Referral program Statement of Inclusivity: We believe different perspectives make Whisker better and strive to create a place where everyone has equal opportunities to thrive. Please ensure to regularly check your email spam folder for any communication from Whisker to avoid missing important updates regarding your application status. #onsite1",https://www.linkedin.com/jobs/view/3941390332,"Whisker, a pet tech company, is seeking a Data Scientist II to lead and execute complex data science projects. This role will leverage statistical analysis, machine learning, and data modeling to drive business growth and optimize operations. The ideal candidate will have 3+ years of experience in data science or engineering, including experience with ETL pipelines, SQL/NoSQL databases, cloud services (AWS), and common ML/DL libraries. Responsibilities include data analysis and modeling, project leadership, machine learning and AI development, data visualization, model deployment, data governance, mentorship, and continuous learning.","Pet Care,Technology,E-commerce,Data Science,Machine Learning","Communication,Collaboration,Leadership,Problem Solving,Analytical Thinking,Decision Making,Project Management,Time Management,Organization,Mentorship,Initiative,Self-Motivation,Teamwork,Confidentiality","Statistical Analysis,Machine Learning,Data Modeling,Data Extraction,Data Manipulation,Data Interpretation,Data Visualization,ETL,SQL,NoSQL,AWS,Python,Pandas,Numpy,Scikit-Learn,Tensorflow,Pytorch,MXNet,StatsModels,Glue,EMR,Spark,RDS,DynamoDB,PostgreSQL,Agile","AWS,Glue,EMR,Spark,RDS,DynamoDB,PostgreSQL,Pandas,Numpy,Scikit-Learn,Tensorflow,Pytorch,MXNet,StatsModels",Python,"{""min_degree"": ""BA/BS/MS"", ""fields"": [""Math"", ""Statistics"", ""Computer Science""]}","{""max"": 0, ""min"": 0}","Premium Medical/Dental/Vision insurance,Paid parental leave,Whisker Parents Program,1 day ""pawternity"" leave for new pet adoption,Pet Insurance,401K match,Flexible spending accounts,Company-paid short-term disability and life insurance,Employee Assistance Program (EAP),Generous paid time off,14 Paid Holidays,Top of the line equipment,Pet-friendly office,Whisker products and swag,Continuing education support,On-site gym with peloton,Referral program"
